<transactions xmlns:xsi="http://www.w3.org/2001/XMLSchema-instance" xsi:noNamespaceSchemaLocation="reservations.xsd"><transaction id="831.3760688937322" payingTool="in_cash"><reservation><room><roomNo>116</roomNo><floorNo>3</floorNo><maxCapacity>4</maxCapacity><hasPersonalBath>false</hasPersonalBath><isAvailable>true</isAvailable><hotel><name>Оазис</name><address country="Канада" town="Калгари" location="Улица: 5-та авеню, Район: Индустриална зона"/></hotel><amenities><amenity>Телевизор</amenity><amenity>Паркинг</amenity><amenity>Румсервиз</amenity><amenity>Портиер</amenity><amenity>Бар</amenity><amenity>Транспорт</amenity><amenity>Портиер</amenity><amenity>Басейн</amenity><amenity>Румсервиз</amenity><amenity>Румсервиз</amenity></amenities><price currency="[object Element]">267.88026292781456</price><type>deluxe</type></room><guests><guest><name>Ангел</name><family>Грозданов</family><email>Angel.Grozdanov@att.net</email><phone>0877876543</phone></guest><guest><name>Васил</name><family>Радев</family><email>Vasil.Radev@gmail.com</email><phone>0876123456</phone></guest><guest><name>Антон</name><family>Радев</family><email>Anton.Radev@icloud.com</email><phone>0876543210</phone></guest><guest><name>Людмила</name><family>Радев</family><email>Lyudmila.Radev@mail.ru</email><phone>+359877876543</phone></guest></guests></reservation><card><IBAN>IQ20CBIQ861800101010500</IBAN><balance>876.180210949997</balance><name>CNY</name></card></transaction></transactions>